{
  "$schema": "https://tinyzkp.com/schemas/tinyzkp-agent-policy.schema.json",
  "name": "TinyZKP Agent Proof Policy",
  "url": "https://tinyzkp.com/agent-policy",
  "generated_at": "2026-06-24",
  "summary": "Recommended policy for AI agents, agent supervisors, and backend automations that decide when to mint, attach, verify, and escalate TinyZKP proof receipts.",
  "positioning": {
    "primary_use": "Proof receipts for high-value agent actions and state transitions",
    "best_for": [
      "Agents that mutate money, records, permissions, inventory, customer-visible state, or customer-visible status",
      "Agent supervisors that need independent verification of workflow checkpoints",
      "Backend tool calls where a downstream service should verify a state transition without replay",
      "Audit and reconciliation agents that publish periodic receipt-bearing checkpoints"
    ],
    "not_for": [
      "Every natural-language message",
      "UI-only interactions with no durable state change",
      "Claims that cannot be encoded into the live proof template or a reviewed custom statement",
      "Private-input claims without a documented template, explicit review status, and supported verifier path"
    ]
  },
  "default_policy": {
    "mint_receipt_when": [
      "An agent action changes durable external state.",
      "A tool-call batch affects money, balances, quotas, inventory, records, permissions, or customer-visible state.",
      "A customer, auditor, downstream service, or supervisor agent will rely on the output.",
      "A checkpoint replaces replay, manual audit export, support evidence, or self-hosted prover operations."
    ],
    "skip_receipt_when": [
      "The action is conversational only.",
      "The output has no durable state transition.",
      "No recipient will inspect or store the receipt.",
      "The statement would require private inputs or custom semantics that have not been reviewed."
    ],
    "always_attach": [
      "receipt_url or receipt object",
      "template_id",
      "plain-language statement",
      "what the receipt proves",
      "what the receipt does not prove",
      "verification path"
    ],
    "never_send_as_transparent_parameters": [
      "API keys",
      "private customer data",
      "secrets",
      "raw credentials",
      "personal data not required for the public statement",
      "unreviewed private proof inputs"
    ]
  },
  "verification_policy": {
    "verify_before_trusting_external_receipts": true,
    "accepted_paths": [
      "https://tinyzkp.com/verify",
      "https://api.tinyzkp.com/verify",
      "MCP verify_proof tool",
      "TinyZKP SDK verifier",
      "first-party WASM verifier where compatible"
    ],
    "reject_or_review_when": [
      "The proof fails verification.",
      "The proof format is below the current accepted floor.",
      "The receipt claims a template, privacy mode, or verifier path not documented in public metadata.",
      "The statement does not match the workflow output the agent is presenting."
    ]
  },
  "receipt_envelope": {
    "schema": "https://tinyzkp.com/schemas/agent-receipt.schema.json",
    "required_fields": [
      "agent_result",
      "receipt"
    ],
    "recommended_fields": [
      "action",
      "tool_call_id",
      "receipt_url",
      "policy.reason",
      "policy.verifier"
    ],
    "example": {
      "action": "ledger_checkpoint",
      "agent_result": {
        "status": "updated",
        "checkpoint_id": "ckpt_2026_06_24"
      },
      "receipt_url": "https://tinyzkp.com/verify#proof=...",
      "policy": {
        "reason": "durable ledger checkpoint",
        "verifier": "customer-visible API response"
      }
    }
  },
  "escalation_triggers": [
    "The proof statement is not an additive state transition covered by accumulator_step.",
    "The workflow needs private-input handling, masking, or secrets.",
    "The verifier must run on-chain, air-gapped, or inside a restricted runtime.",
    "The workflow needs reserved concurrency, custom spend controls, or contractual support targets.",
    "The receipt is customer-, auditor-, counterparty-, or regulator-visible and requires procurement review.",
    "The trace size or latency profile suggests Compute planning."
  ],
  "integration_surfaces": {
    "mcp": "https://tinyzkp.com/mcp",
    "http_api": "https://tinyzkp.com/openapi.json",
    "recipes": "https://tinyzkp.com/recipes",
    "examples": "https://tinyzkp.com/examples",
    "limits": "https://tinyzkp.com/limits",
    "templates": "https://tinyzkp.com/templates",
    "security_status": "https://tinyzkp.com/security"
  },
  "links": {
    "agent_policy": "https://tinyzkp.com/agent-policy",
    "agent_policy_metadata": "https://tinyzkp.com/agent-policy.json",
    "agent_policy_schema": "https://tinyzkp.com/schemas/tinyzkp-agent-policy.schema.json",
    "agents": "https://tinyzkp.com/agents",
    "agent_platforms": "https://tinyzkp.com/agent-platforms",
    "platform_rollout": "https://tinyzkp.com/platform-rollout",
    "platform_rollout_metadata": "https://tinyzkp.com/platform-rollout.json",
    "mcp": "https://tinyzkp.com/mcp",
    "mcp_metadata": "https://tinyzkp.com/mcp.json",
    "recipes": "https://tinyzkp.com/recipes",
    "agent_receipt_schema": "https://tinyzkp.com/schemas/agent-receipt.schema.json",
    "receipt_schema": "https://tinyzkp.com/schemas/tinyzkp-receipt.schema.json",
    "examples": "https://tinyzkp.com/examples",
    "examples_metadata": "https://tinyzkp.com/examples.json",
    "limits": "https://tinyzkp.com/limits",
    "limits_metadata": "https://tinyzkp.com/limits.json",
    "templates": "https://tinyzkp.com/templates",
    "templates_metadata": "https://tinyzkp.com/templates.json",
    "openapi": "https://tinyzkp.com/openapi.json",
    "security_status": "https://tinyzkp.com/security",
    "security_review": "https://tinyzkp.com/security",
    "pilot_program": "https://tinyzkp.com/pilot"
  }
}
